{
  "apiVersion": "interlock.dev/v1alpha1",
  "interactionCount": 8,
  "kind": "SecurityStatistics",
  "partitions": [
    {
      "byActor": [
        {
          "counters": {
            "blockDecisionCount": 4,
            "enforcedBlockCount": 2,
            "executionAttemptCount": 5,
            "executionSuccessCount": 4,
            "interactionCount": 7,
            "partialOrBypassCount": 1,
            "shadowWouldBlockCount": 2
          },
          "sourceActorId": "support-agent"
        }
      ],
      "byMode": [
        {
          "counters": {
            "blockDecisionCount": 2,
            "enforcedBlockCount": 2,
            "executionAttemptCount": 3,
            "executionSuccessCount": 2,
            "interactionCount": 5,
            "partialOrBypassCount": 1,
            "shadowWouldBlockCount": 0
          },
          "mode": "ENFORCE"
        },
        {
          "counters": {
            "blockDecisionCount": 2,
            "enforcedBlockCount": 0,
            "executionAttemptCount": 2,
            "executionSuccessCount": 2,
            "interactionCount": 2,
            "partialOrBypassCount": 0,
            "shadowWouldBlockCount": 2
          },
          "mode": "SHADOW"
        }
      ],
      "byPolicy": [
        {
          "counters": {
            "blockDecisionCount": 1,
            "enforcedBlockCount": 0,
            "executionAttemptCount": 1,
            "executionSuccessCount": 1,
            "interactionCount": 1,
            "partialOrBypassCount": 0,
            "shadowWouldBlockCount": 1
          },
          "policyId": "policy.export-hold"
        },
        {
          "counters": {
            "blockDecisionCount": 1,
            "enforcedBlockCount": 1,
            "executionAttemptCount": 3,
            "executionSuccessCount": 2,
            "interactionCount": 4,
            "partialOrBypassCount": 1,
            "shadowWouldBlockCount": 0
          },
          "policyId": "policy.support-crm"
        },
        {
          "counters": {
            "blockDecisionCount": 2,
            "enforcedBlockCount": 1,
            "executionAttemptCount": 1,
            "executionSuccessCount": 1,
            "interactionCount": 2,
            "partialOrBypassCount": 0,
            "shadowWouldBlockCount": 1
          },
          "policyId": "policy.support-web"
        }
      ],
      "byReasonCode": [
        {
          "interactionCount": 1,
          "reasonCode": "INTERLOCK-APPROVAL-REQUIRED"
        },
        {
          "interactionCount": 1,
          "reasonCode": "INTERLOCK-TAINTED-EXTERNAL-WRITE"
        },
        {
          "interactionCount": 1,
          "reasonCode": "L1-M2-DEFINITION-DRIFT"
        },
        {
          "interactionCount": 2,
          "reasonCode": "L1-M9-NEW-DESTINATION"
        },
        {
          "interactionCount": 1,
          "reasonCode": "L1-UNDECLARED-SIDE-EFFECT"
        }
      ],
      "byRelationship": [
        {
          "counters": {
            "blockDecisionCount": 2,
            "enforcedBlockCount": 1,
            "executionAttemptCount": 4,
            "executionSuccessCount": 3,
            "interactionCount": 5,
            "partialOrBypassCount": 1,
            "shadowWouldBlockCount": 1
          },
          "relationshipId": "REL-05"
        },
        {
          "counters": {
            "blockDecisionCount": 2,
            "enforcedBlockCount": 1,
            "executionAttemptCount": 1,
            "executionSuccessCount": 1,
            "interactionCount": 2,
            "partialOrBypassCount": 0,
            "shadowWouldBlockCount": 1
          },
          "relationshipId": "REL-07"
        }
      ],
      "counters": {
        "blockDecisionCount": 4,
        "enforcedBlockCount": 2,
        "executionAttemptCount": 5,
        "executionSuccessCount": 4,
        "interactionCount": 7,
        "partialOrBypassCount": 1,
        "shadowWouldBlockCount": 2
      },
      "dataSource": "PRODUCTION",
      "outcomes": {
        "BLOCKED": 2,
        "PARTIALLY_EXECUTED": 1,
        "SUCCEEDED": 2,
        "UNKNOWN": 2
      },
      "timeSeries": [
        {
          "bucketStart": "2026-07-19T10:00:00Z",
          "counters": {
            "blockDecisionCount": 1,
            "enforcedBlockCount": 1,
            "executionAttemptCount": 1,
            "executionSuccessCount": 1,
            "interactionCount": 2,
            "partialOrBypassCount": 0,
            "shadowWouldBlockCount": 0
          }
        },
        {
          "bucketStart": "2026-07-19T11:00:00Z",
          "counters": {
            "blockDecisionCount": 3,
            "enforcedBlockCount": 1,
            "executionAttemptCount": 4,
            "executionSuccessCount": 3,
            "interactionCount": 5,
            "partialOrBypassCount": 1,
            "shadowWouldBlockCount": 2
          }
        }
      ]
    },
    {
      "byActor": [
        {
          "counters": {
            "blockDecisionCount": 1,
            "enforcedBlockCount": 1,
            "executionAttemptCount": 0,
            "executionSuccessCount": 0,
            "interactionCount": 1,
            "partialOrBypassCount": 0,
            "shadowWouldBlockCount": 0
          },
          "sourceActorId": "red-team-agent"
        }
      ],
      "byMode": [
        {
          "counters": {
            "blockDecisionCount": 1,
            "enforcedBlockCount": 1,
            "executionAttemptCount": 0,
            "executionSuccessCount": 0,
            "interactionCount": 1,
            "partialOrBypassCount": 0,
            "shadowWouldBlockCount": 0
          },
          "mode": "ENFORCE"
        }
      ],
      "byPolicy": [
        {
          "counters": {
            "blockDecisionCount": 1,
            "enforcedBlockCount": 1,
            "executionAttemptCount": 0,
            "executionSuccessCount": 0,
            "interactionCount": 1,
            "partialOrBypassCount": 0,
            "shadowWouldBlockCount": 0
          },
          "policyId": "policy.support-crm"
        }
      ],
      "byReasonCode": [
        {
          "interactionCount": 1,
          "reasonCode": "L1-M9-VOLUME-EXCEEDED"
        }
      ],
      "byRelationship": [
        {
          "counters": {
            "blockDecisionCount": 1,
            "enforcedBlockCount": 1,
            "executionAttemptCount": 0,
            "executionSuccessCount": 0,
            "interactionCount": 1,
            "partialOrBypassCount": 0,
            "shadowWouldBlockCount": 0
          },
          "relationshipId": "REL-05"
        }
      ],
      "counters": {
        "blockDecisionCount": 1,
        "enforcedBlockCount": 1,
        "executionAttemptCount": 0,
        "executionSuccessCount": 0,
        "interactionCount": 1,
        "partialOrBypassCount": 0,
        "shadowWouldBlockCount": 0
      },
      "dataSource": "SIMULATION",
      "outcomes": {
        "BLOCKED": 1
      },
      "timeSeries": [
        {
          "bucketStart": "2026-07-19T11:00:00Z",
          "counters": {
            "blockDecisionCount": 1,
            "enforcedBlockCount": 1,
            "executionAttemptCount": 0,
            "executionSuccessCount": 0,
            "interactionCount": 1,
            "partialOrBypassCount": 0,
            "shadowWouldBlockCount": 0
          }
        }
      ]
    }
  ]
}
